{
  "schema_version": 1,
  "name": "free",
  "policy_version": 1,
  "bindings": {
    "orchestrator": "freellmapi/auto:default",
    "planner": "freellmapi/auto:planning",
    "coder": "freellmapi/auto:coding",
    "wayfinder": "freellmapi/auto:wayfinder",
    "researcher": "freellmapi/auto:research",
    "verifier": "freellmapi/auto:verification",
    "reviewer": "freellmapi/auto:review",
    "judge": "freellmapi/auto:reasoning",
    "committer": "freellmapi/auto:utility"
  }
}
